{
  "id": 185459234,
  "type": "TRANSACTION_ALERT",
  "created_at": "2021-03-23T16:01:00Z",
  "body": {
    "alert_type": "fraud",
    "is_3d_secure": false,
    "arn": "123456789",
    "bin_number": "234567",
    "number_last4": "2345",
    "billing_descriptor": "SOME SERVICE",
    "transaction_value": {
      "amount": 11211,
      "amount_decimal": "112.11",
      "currency": "USD"
    },
    "refund_value": {
      "amount": 11211,
      "amount_decimal": "112.11",
      "currency": "USD"
    },
    "transaction_timestamp": "2021-03-25T00:00:00Z",
    "alert_timestamp": "2021-05-02T00:00:00Z",
    "transaction_id": 12345678,
    "transaction_reference": "fraud_txn_unique_ref",
    "merchant_reference": "234567",
    "issuer": "Bank ABC",
    "authorization_code": "123456",
    "reason_code": "4840",
    "source": 2,
    "source_id": "127327139872"
  }
}
