{
  "id": 185459234,
  "type": "TRANSACTION_ALERT",
  "created_at": "2021-03-23T16:01:00Z",
  "body": {
    "alert_type": "dispute",
    "is_3d_secure": null,
    "arn": "1122334455667788",
    "bin_number": "123456",
    "number_last4": "1234",
    "billing_descriptor": "MY ONLINE SERVICE 123*",
    "transaction_value": {
      "amount": 2345,
      "amount_decimal": "23.45",
      "currency": "EUR"
    },
    "refund_value": {
      "amount": 2345,
      "amount_decimal": "23.45",
      "currency": "EUR"
    },
    "transaction_timestamp": "2021-03-20T11:01:00Z",
    "alert_timestamp": "2021-03-23T15:55:00Z",
    "transaction_id": 11122233444,
    "transaction_reference": "txn_unique_reference",
    "merchant_reference": "123456",
    "issuer": "Bank ABC",
    "authorization_code": "123456",
    "reason_code": "13.3",
    "source": 1,
    "source_id": "ABCBNM123456ZXC"
  }
}
